<?xml version="1.0" encoding="UTF-8"?>
<test-case xmlns:xs="http://www.w3.org/2001/XMLSchema"
           xmlns:xsi="http://www.w3.org/2001/XMLSchema-instance"
           xmlns="http://www.w3c.org/MarkUp/Forms/XForms/Test/Runner"
           xmlns:xf="http://www.w3.org/2002/xforms"
           xsi:schemaLocation="http://www.w3c.org/MarkUp/Forms/XForms/Test/Runner ../test-case.xsd">
    <open href="Chapt02/2.2.a.xhtml"/>
    <assert-title title="2.2.a Example: Encapsulation of Instance Data"/>
    <assert-selection-options locator="xf-select1-1" options="Cash,Credit" />
	<assert-control-present locator="xf-input-1" type="input" />
	<assert-control-present locator="xf-input-2" type="input" />
	<type-input locator="xf-input-1" value="4012888888881881" />
	<type-input locator="xf-input-2" value="2001-08" />
	<click locator="xf-submit-1" />
	<wait-for-page-to-load />
	<assert-title title="Results from echo.sh" />
	<assert-text-present text="method=&quot;cc&quot;" />
	<assert-text-present text="&lt;number&gt;4012888888881881&lt;/number&gt;" />
	<assert-text-present text="&lt;expiry&gt;2001-08&lt;/expiry&gt;" />
	   
    <open href="Chapt02/2.2.a.xhtml"/>
    <assert-title title="2.2.a Example: Encapsulation of Instance Data"/>
	<select-option locator="xf-select1-1" option="Cash"/>
	<click locator="xf-submit-1" />
	<wait-for-page-to-load />
	<assert-title title="Results from echo.sh" />
	<assert-text-present text="method=&quot;cash&quot;" />
	<assert-text-present text="&lt;number/&gt;" />
	<assert-text-present text="&lt;expiry/&gt;" />
</test-case>